{
  "$schema": "https://json-schema.org/draft/2020-12/schema",
  "$id": "https://github.com/Chiv2-Community/ue-pak-static-risk-analysis/schemas/facts-v1.schema.json",
  "title": "Bounded invocation facts v1",
  "description": "Structural contract only; FactsCodec also enforces duplicate keys, byte/depth/node bounds, Unicode, identities and evaluator invariants.",
  "type": "object",
  "additionalProperties": false,
  "required": ["schema-version", "pak-sha256", "engine-version", "producer-version", "dependencies", "analysis"],
  "properties": {
    "schema-version": {"const": 1},
    "pak-sha256": {"$ref": "#/$defs/hash"},
    "engine-version": {"const": "4.25"},
    "producer-version": {"$ref": "#/$defs/identity"},
    "dependencies": {"type": "array", "maxItems": 256, "items": {"$ref": "#/$defs/dependency"}},
    "inspection": {"$ref": "#/$defs/inspection"},
    "asset-data": {"$ref": "#/$defs/asset-data"},
    "analysis": {
      "type": "object", "additionalProperties": false,
      "required": ["invocations", "coverage-gaps"],
      "properties": {
        "invocations": {"type": "array", "maxItems": 10000, "items": {"$ref": "#/$defs/invocation"}},
        "dispatches": {"type": "array", "maxItems": 10000, "items": {"$ref": "#/$defs/dispatch"}},
        "call-graph": {"$ref": "#/$defs/call-graph"},
        "coverage-gaps": {"type": "array", "maxItems": 256, "items": {"enum": ["unsupported-parsing", "unresolved-dispatch", "incomplete-extraction"]}}
      }
    }
  },
  "$defs": {
    "data-path": {"type": "array", "minItems": 1, "maxItems": 32, "items": {
      "type": "object", "additionalProperties": false, "required": ["property", "array-index", "element"],
      "properties": {"property": {"type": ["string", "null"], "minLength": 1, "maxLength": 4096}, "array-index": {"type": "integer", "minimum": 0, "maximum": 2147483647}, "element": {"type": ["integer", "null"], "minimum": 0, "maximum": 2147483647}}
    }},
    "data-value": {"oneOf": [
      {"type": "object", "additionalProperties": false, "required": ["kind", "reason"], "properties": {"kind": {"const": "unknown"}, "reason": {"$ref": "#/$defs/text"}}},
      {"type": "object", "additionalProperties": false, "required": ["kind", "value"], "properties": {"kind": {"const": "text"}, "value": {"$ref": "#/$defs/text"}}},
      {"type": "object", "additionalProperties": false, "required": ["kind", "value"], "properties": {"kind": {"const": "boolean"}, "value": {"type": "boolean"}}},
      {"type": "object", "additionalProperties": false, "required": ["kind", "value", "type"], "properties": {"kind": {"const": "integer"}, "value": {"type": "integer", "minimum": -9223372036854775808, "maximum": 9223372036854775807}, "type": {"enum": ["int32", "int64"]}}},
      {"type": "object", "additionalProperties": false, "required": ["kind", "value"], "properties": {"kind": {"const": "name"}, "value": {"$ref": "#/$defs/text"}}},
      {"type": "object", "additionalProperties": false, "required": ["kind", "type", "value"], "properties": {"kind": {"const": "enumeration"}, "type": {"$ref": "#/$defs/text"}, "value": {"$ref": "#/$defs/text"}}},
      {"type": "object", "additionalProperties": false, "required": ["kind"], "properties": {"kind": {"const": "null-reference"}}},
      {"$ref": "#/$defs/data-reference"},
      {"type": "object", "additionalProperties": false, "required": ["kind", "object", "function"], "properties": {"kind": {"const": "delegate"}, "object": {"$ref": "#/$defs/data-value"}, "function": {"$ref": "#/$defs/text"}}},
      {"type": "object", "additionalProperties": false, "required": ["kind", "type", "count"], "properties": {"kind": {"const": "container"}, "type": {"enum": ["array", "struct"]}, "count": {"type": "integer", "minimum": 0, "maximum": 2147483647}}}
    ]},
    "data-reference": {"type": "object", "additionalProperties": false, "required": ["kind", "package-index", "owner", "object-name", "target-kind"],
      "properties": {"kind": {"const": "reference"}, "package-index": {"type": "integer", "minimum": -2147483648, "maximum": 2147483647}, "owner": {"$ref": "#/$defs/text"}, "object-name": {"$ref": "#/$defs/text"}, "target-kind": {"enum": ["local-class", "local-object", "import-symbol"]}}
    },
    "asset-data": {
      "type": "object", "additionalProperties": false, "required": ["schema-version", "content-root", "logical-root", "complete", "packages"],
      "properties": {"schema-version": {"const": 1}, "content-root": {"$ref": "#/$defs/text"}, "logical-root": {"$ref": "#/$defs/text"}, "complete": {"type": "boolean"},
        "packages": {"type": "array", "maxItems": 4096, "items": {
          "type": "object", "additionalProperties": false, "required": ["member-id", "evidence"],
          "properties": {"member-id": {"$ref": "#/$defs/identity"}, "evidence": {
            "type": "object", "additionalProperties": false, "required": ["schema-version", "asset", "complete", "properties", "diagnostics"],
            "properties": {"schema-version": {"const": 1}, "asset": {"$ref": "#/$defs/text"}, "complete": {"type": "boolean"},
              "diagnostics": {"type": "array", "maxItems": 64, "items": {"$ref": "#/$defs/text"}},
              "properties": {"type": "array", "maxItems": 4096, "items": {
                "type": "object", "additionalProperties": false, "required": ["export-index", "object-identity", "class-identity", "class-default-flag", "path", "value"],
                "properties": {"export-index": {"type": "integer", "minimum": 1, "maximum": 4096}, "object-identity": {"type": ["string", "null"], "maxLength": 4096}, "class-identity": {"type": ["string", "null"], "maxLength": 4096}, "class-default-flag": {"type": "boolean"}, "path": {"$ref": "#/$defs/data-path"}, "value": {"$ref": "#/$defs/data-value"}}
              }}
            }
          }}
        }}
      }
    },
    "call-graph": {
      "type": "object", "additionalProperties": false, "required": ["schema-version", "complete", "functions"],
      "properties": {
        "schema-version": {"const": 1}, "complete": {"type": "boolean"},
        "functions": {"type": "array", "maxItems": 4096, "items": {
          "type": "object", "additionalProperties": false, "required": ["asset", "location-function", "owner", "function", "native"],
          "properties": {
            "asset": {"$ref": "#/$defs/text"}, "location-function": {"$ref": "#/$defs/text"},
            "owner": {"type": "string", "maxLength": 4096, "pattern": "^/[A-Za-z0-9_]+(?:/[A-Za-z0-9_]+)*(?:\\.[A-Za-z0-9_]+)+$"},
            "function": {"type": "string", "maxLength": 4096, "pattern": "^[A-Za-z_][A-Za-z0-9_]*$"}, "native": {"type": "boolean"}
          }
        }}
      }
    },
    "dispatch": {
      "type": "object", "additionalProperties": false,
      "required": ["schema-version", "origin", "opcode", "kind", "function-name", "receiver", "resolution", "candidates", "diagnostics", "source"],
      "properties": {
        "schema-version": {"const": 1}, "origin": {"$ref": "#/$defs/location"},
        "opcode": {"enum": ["EX_VirtualFunction", "EX_LocalVirtualFunction", "EX_BindDelegate", "EX_InstanceDelegate", "EX_AddMulticastDelegate", "EX_RemoveMulticastDelegate", "EX_ClearMulticastDelegate", "EX_LetDelegate", "EX_LetMulticastDelegate", "EX_CallMulticastDelegate", "EX_FinalFunction", "EX_LocalFinalFunction", "EX_CallMath"]},
        "kind": {"enum": ["virtual", "delegate-binding", "delegate-mutation", "multicast", "timer"]},
        "function-name": {"type": ["string", "null"], "maxLength": 4096, "pattern": "^[A-Za-z_][A-Za-z0-9_]*$"},
        "receiver": {"enum": ["self", "object", "interface", "unknown"]},
        "resolution": {"const": "possible"},
        "source": {"enum": ["kismet-serialized-v1", "ue425plus-2d1aae-kismet-timer"]},
        "candidates": {"type": "array", "maxItems": 256, "uniqueItems": true, "items": {
          "type": "object", "additionalProperties": false, "required": ["owner", "function", "provenance"],
          "properties": {"owner": {"type": "string", "maxLength": 4096, "pattern": "^/[A-Za-z0-9_]+(?:/[A-Za-z0-9_]+)*(?:\\.[A-Za-z0-9_]+)+$"}, "function": {"type": "string", "maxLength": 4096, "pattern": "^[A-Za-z_][A-Za-z0-9_]*$"},
            "provenance": {"enum": ["local-function", "inherited-function", "override", "interface-implementation", "imported-function"]}}
        }},
        "diagnostics": {"type": "array", "minItems": 1, "maxItems": 16, "uniqueItems": true, "items": {
          "enum": ["open-world", "receiver-unavailable", "parent-unavailable", "class-cycle", "target-name-unavailable", "target-metadata-unavailable", "target-expansion-limit", "native-build-unverified", "binding-flow-unresolved", "dependency-context-unavailable", "interface-context-unavailable", "class-metadata-unavailable", "unbound-delegate"]
        }}
      },
      "allOf": [
        {"if": {"properties": {"kind": {"const": "virtual"}}}, "then": {"properties": {"opcode": {"enum": ["EX_VirtualFunction", "EX_LocalVirtualFunction"]}, "source": {"const": "kismet-serialized-v1"}}}},
        {"if": {"properties": {"kind": {"const": "delegate-binding"}}}, "then": {"properties": {"opcode": {"enum": ["EX_BindDelegate", "EX_InstanceDelegate"]}, "source": {"const": "kismet-serialized-v1"}}}},
        {"if": {"properties": {"kind": {"const": "delegate-mutation"}}}, "then": {"properties": {"opcode": {"enum": ["EX_AddMulticastDelegate", "EX_RemoveMulticastDelegate", "EX_ClearMulticastDelegate", "EX_LetDelegate", "EX_LetMulticastDelegate"]}, "source": {"const": "kismet-serialized-v1"}}}},
        {"if": {"properties": {"kind": {"const": "multicast"}}}, "then": {"properties": {"opcode": {"const": "EX_CallMulticastDelegate"}, "source": {"const": "kismet-serialized-v1"}}}},
        {"if": {"properties": {"kind": {"const": "timer"}}}, "then": {"properties": {"opcode": {"enum": ["EX_FinalFunction", "EX_LocalFinalFunction", "EX_CallMath"]}, "source": {"const": "ue425plus-2d1aae-kismet-timer"}}}}
      ]
    },
    "inspection": {
      "type": "object", "additionalProperties": false, "required": ["status", "diagnostic", "members"],
      "properties": {
        "status": {"enum": ["validated", "rejected"]},
        "diagnostic": {"$ref": "#/$defs/identity"},
        "members": {"type": "array", "maxItems": 10000, "items": {
          "type": "object", "additionalProperties": false,
          "required": ["id", "path", "size", "sha256", "status", "signatures", "classes", "inspection-status", "sidecar-status"],
          "properties": {
            "id": {"$ref": "#/$defs/identity"}, "path": {"$ref": "#/$defs/text"},
            "path-normalized": {"type": "boolean"},
            "size": {"type": ["integer", "null"], "minimum": 0, "maximum": 9223372036854775807},
            "sha256": {"type": ["string", "null"], "pattern": "^[a-f0-9]{64}$"},
            "status": {"enum": ["uninspected", "rejected", "payload_verified"]},
            "signatures": {"type": "array", "maxItems": 16, "items": {"$ref": "#/$defs/identity"}},
            "classes": {"type": "array", "maxItems": 256, "items": {"$ref": "#/$defs/text"}},
            "inspection-status": {"$ref": "#/$defs/identity"}, "sidecar-status": {"$ref": "#/$defs/identity"},
            "parsed-classes-complete": {"type": "boolean"},
            "parsed-classes": {"type": "array", "maxItems": 256, "items": {
              "type": "object", "additionalProperties": false, "required": ["identity", "provenance"],
              "properties": {
                "identity": {"type": "string", "maxLength": 4096, "pattern": "^/[A-Za-z0-9_]+(?:/[A-Za-z0-9_]+)*(?:\\.[A-Za-z0-9_]+)+$"},
                "provenance": {"enum": ["export-class-index-import", "export-class-index-export"]}
              }
            }}
          }
        }}
      }
    },
    "hash": {"type": "string", "pattern": "^[a-f0-9]{64}$"},
    "identity": {"type": "string", "minLength": 1, "maxLength": 128, "pattern": "^[A-Za-z0-9._+\\-]+$"},
    "text": {"type": "string", "maxLength": 4096},
    "dependency": {
      "type": "object", "additionalProperties": false, "required": ["kind", "sha256"],
      "properties": {"kind": {"$ref": "#/$defs/identity"}, "sha256": {"$ref": "#/$defs/hash"}}
    },
    "location": {
      "type": "object", "additionalProperties": false, "required": ["asset", "function", "offset"],
      "properties": {"asset": {"$ref": "#/$defs/text"}, "function": {"$ref": "#/$defs/text"}, "offset": {"type": "integer", "minimum": 0, "maximum": 9223372036854775807}}
    },
    "target": {"oneOf": [
      {"type": "object", "additionalProperties": false, "required": ["kind", "owner", "function"],
       "properties": {"kind": {"const": "resolved"}, "owner": {"$ref": "#/$defs/text"}, "function": {"$ref": "#/$defs/text"}}},
      {"type": "object", "additionalProperties": false, "required": ["kind"], "properties": {"kind": {"const": "unresolved"}}}
    ]},
    "literal": {"oneOf": [
      {"type": "object", "additionalProperties": false, "required": ["kind", "value"], "properties": {"kind": {"const": "string"}, "value": {"$ref": "#/$defs/text"}}},
      {"type": "object", "additionalProperties": false, "required": ["kind", "value"], "properties": {"kind": {"const": "integer"}, "value": {"type": "integer", "minimum": -9223372036854775808, "maximum": 9223372036854775807}}},
      {"type": "object", "additionalProperties": false, "required": ["kind", "value"], "properties": {"kind": {"const": "boolean"}, "value": {"type": "boolean"}}},
      {"type": "object", "additionalProperties": false, "required": ["kind"], "properties": {"kind": {"const": "null"}}}
    ]},
    "argument-value": {"oneOf": [
      {"type": "object", "additionalProperties": false, "required": ["kind", "value"], "properties": {"kind": {"const": "constant"}, "value": {"$ref": "#/$defs/literal"}}},
      {"type": "object", "additionalProperties": false, "required": ["kind"], "properties": {"kind": {"enum": ["dynamic", "missing"]}}}
    ]},
    "arguments": {"oneOf": [
      {"type": "object", "additionalProperties": false, "required": ["kind", "arguments"], "properties": {
        "kind": {"const": "known"},
        "arguments": {"type": "array", "maxItems": 256, "items": {
          "type": "object", "additionalProperties": false, "required": ["name", "value"],
          "properties": {"name": {"$ref": "#/$defs/text"}, "value": {"$ref": "#/$defs/argument-value"}}
        }}
      }},
      {"type": "object", "additionalProperties": false, "required": ["kind"], "properties": {"kind": {"const": "unavailable"}}}
    ]},
    "invocation": {
      "type": "object", "additionalProperties": false, "required": ["location", "target", "arguments"],
      "properties": {"location": {"$ref": "#/$defs/location"}, "target": {"$ref": "#/$defs/target"}, "arguments": {"$ref": "#/$defs/arguments"}}
    }
  }
}
